{"version":"1","id":"20000000-0000-4000-8000-000000000007","type":"motion.finished","timestamp":"2026-08-17T08:00:01.814Z","device_id":"lefly-sim-01","correlation_id":"10000000-0000-4000-8000-000000000001","payload":{"action":"nod","status":"completed","elapsed_ms":1814,"joints":{"base_yaw":0,"base_pitch":-25,"elbow_pitch":60,"wrist_roll":0,"wrist_pitch":18},"reason":null,"error":null}}
